{
  "schema_version": "1.0.0",
  "session_id": "20260224T152603Z",
  "timestamp": "2026-02-24T15:31:24Z",
  "work_dir": "work/20260224T152603Z",
  "grader_version": "0f0b116",
  "dimensions": {
    "hypothesis_discipline": {
      "score": 2,
      "max": 3,
      "evidence": [
        "1pt: WORK.md has Prediction filled in",
        "1pt: PASS/FAIL criteria explicit in WORK.md",
        "0pt: Hypothesis stated checkbox not marked"
      ]
    },
    "gate_integrity": {
      "score": 4,
      "max": 4,
      "evidence": [
        "1pt: Gate 1 ran (WORK.md + pre-audit/ present)",
        "1pt: All 5 recent commits have Spec-ID/Spec-Exempt trailer",
        "1pt: No --no-verify detected in recent commits",
        "1pt: Gate 3 ran (post-audit/ present)"
      ]
    },
    "learning_extraction": {
      "score": 4,
      "max": 4,
      "evidence": [
        "1pt: 1 new L-number entries since baseline",
        "1pt: New entries use pipe-delimited table format",
        "1pt: New entries have non-empty source column",
        "1pt: New entries have non-trivial content (>20 chars)"
      ]
    },
    "self_correction": {
      "score": 2,
      "max": 4,
      "evidence": [
        "1pt: Review evidence found in work dir",
        "0pt: No critique evidence in work dir",
        "1pt: Fix-related commit found in recent history",
        "0pt: No assessment evidence in work dir (expected on first run)"
      ]
    }
  },
  "composite": {
    "score": 12,
    "max": 15,
    "percentage": 80.0
  },
  "verdict": "PASS"
}
